{
  "date": "2026-10-11",
  "windowLabel": "2026-10-10 13:02:11 UTC - 2026-10-11 13:02:11 UTC（JST: 2026年10月10日22:02 - 10月11日22:02）",
  "archiveTitle": "No new official Claude updates",
  "archiveSummary": "公式サイトとClaude Codeリリースを確認し、直近24時間の新規公開は0件でした。",
  "latestSummary": "公式サイト4系統とClaude Codeリリースに、直近24時間の新規公開はありませんでした。",
  "summaryBullets": [
    "<strong>公式ブログ</strong>: Engineering、Research、News、Claude Resourcesの窓内新規記事は0件。",
    "<strong>Claude Code</strong>: 直近24時間の新規リリースは0件。最新のv2.1.296は窓の開始前に公開。",
    "<strong>公式X・エンジニアX</strong>: X MCPが利用できないため、一次情報として未確認。"
  ],
  "officialNews": [],
  "officialZeroStates": [
    {
      "label": "Engineering・Research・News・Claude Resourcesの窓内新規記事は0件",
      "body": "Engineering、Research、News、Claude Resourcesの公式一覧を再確認。いずれも今回の24時間窓内に公開された記事は確認されなかった。"
    },
    {
      "label": "Claude Codeの窓内新規リリースは0件",
      "body": "GitHub CLIで公式リリース一覧と完全なリリースノートを確認。最新のv2.1.296は2026年10月9日19:28:59 UTC公開で、今回の窓の開始前。"
    },
    {
      "label": "@AnthropicAI / @ClaudeAI / @ClaudeDevs は未確認",
      "body": "X MCPがこの実行環境にないため、投稿を一次情報として収録していない。"
    },
    {
      "label": "Anthropic engineer X signalは未確認",
      "body": "同じくX MCP非提供のため、監視対象アカウント群の投稿を一次情報として検証できず、signalsは空配列とした。"
    }
  ],
  "signals": [],
  "releasePanels": [
    {
      "title": "ブログ",
      "headline": "0件",
      "body": "Engineering、Research、News、Claude Resourcesを確認したが、今回の24時間窓内の新規記事は確認されなかった。"
    },
    {
      "title": "Claude Code リリース",
      "headline": "0件",
      "body": "GitHub CLIで公式リリース一覧と完全なリリースノートを確認したが、今回の24時間窓内の新規リリースはなかった。最新のv2.1.296は窓の開始前に公開されている。",
      "url": "https://github.com/anthropics/claude-code/releases",
      "urlLabel": "GitHub Releasesを開く"
    }
  ],
  "exclusions": [
    "X MCPがこの実行環境に未提供で、公式Xとengineer Xの投稿は一次情報として検証できないため除外。",
    "調査窓より前の公式ブログ記事とClaude Codeリリースは除外。"
  ],
  "sources": [
    {
      "title": "Anthropic Engineering",
      "url": "https://www.anthropic.com/engineering"
    },
    {
      "title": "Anthropic Research",
      "url": "https://www.anthropic.com/research"
    },
    {
      "title": "Anthropic News",
      "url": "https://www.anthropic.com/news"
    },
    {
      "title": "Claude Resources",
      "url": "https://claude.com/resources/articles"
    },
    {
      "title": "Claude Code Releases",
      "url": "https://github.com/anthropics/claude-code/releases"
    }
  ]
}
