{
  "date": "2026-10-26",
  "windowLabel": "2026-10-25 05:57:31 UTC - 2026-10-26 05:57:31 UTC（JST: 2026年10月25日 14:57:31 - 10月26日 14:57:31）",
  "archiveTitle": "No new official Claude updates",
  "archiveSummary": "対象24時間内に公式ブログ・Claude Codeリリースの新規掲載は確認されなかった。",
  "latestSummary": "公式4サイトとClaude Codeのリリースを確認したが、対象24時間内の新規掲載は0件。X投稿は専用接続がないため未確認。",
  "summaryBullets": [
    "<strong>公式ブログ</strong>: Engineering、Research、Anthropic News、Claude Resourcesの対象24時間内の新規掲載は0件。",
    "<strong>Claude Code</strong>: 最新のv2.1.310は対象窓の開始前に公開済みで、新規リリースは0件。",
    "<strong>X投稿</strong>: 専用接続がないため、公式・エンジニア投稿は未確認。"
  ],
  "officialNews": [],
  "officialZeroStates": [
    {"label": "Engineeringの窓内新規記事は0件", "body": "公式一覧の最新記事は10月13日付で、対象24時間内の新規記事は確認できなかった。"},
    {"label": "Researchの窓内新規記事は0件", "body": "公式一覧の最新記事は10月23日付で、対象24時間内の新規記事は確認できなかった。"},
    {"label": "Anthropic Newsの窓内新規記事は0件", "body": "公式一覧で確認できる最新掲載は10月22日付で、対象24時間内の新規記事は確認できなかった。"},
    {"label": "Claude Resourcesの窓内新規記事は0件", "body": "公式一覧の最新掲載は10月23日付で、対象24時間内の新規記事は確認できなかった。"},
    {"label": "Xの投稿は未確認", "body": "X接続がこの実行環境にないため、公式・監視対象エンジニアの投稿は確認できていない。"}
  ],
  "signals": [],
  "releasePanels": [
    {
      "title": "ブログ",
      "headline": "0件",
      "body": "Engineering、Research、Anthropic News、Claude Resourcesを確認。対象24時間内の新規掲載はなかった。",
      "url": "https://www.anthropic.com/news",
      "urlLabel": "Anthropic Newsを開く"
    },
    {
      "title": "Claude Code リリース",
      "headline": "0件",
      "body": "GitHub CLIで公式リリースを完全照合。最新のv2.1.310は2026年10月24日 08:39 JSTに公開され、今回の対象窓開始前のため収録対象外。",
      "url": "https://github.com/anthropics/claude-code/releases",
      "urlLabel": "GitHubリリースを開く"
    }
  ],
  "exclusions": [
    "Xの投稿・関連返信を検証する専用接続がないため、公式・エンジニア投稿は未確認。",
    "Claude Code v2.1.310は対象窓の開始前に公開されており、全26項目のリリースノートは今回の0件レポートに再掲しない。",
    "公式サイト記事は公開時刻非表示のため、掲載日が対象窓外のものは収録していない。"
  ],
  "sources": [
    {"title": "Anthropic Engineering", "url": "https://www.anthropic.com/engineering"},
    {"title": "Anthropic Research", "url": "https://www.anthropic.com/research"},
    {"title": "Anthropic News", "url": "https://www.anthropic.com/news"},
    {"title": "Claude Resources", "url": "https://claude.com/resources/articles"},
    {"title": "Claude Code releases", "url": "https://github.com/anthropics/claude-code/releases"}
  ]
}
