{
  "date": "2026-10-18",
  "windowLabel": "2026-10-17 06:02:10 UTC - 2026-10-18 06:02:10 UTC（JST: 2026年10月17日 15:02:10 - 10月18日 15:02:10）",
  "archiveTitle": "Claude news: no confirmed releases",
  "archiveSummary": "対象期間内のClaude Codeリリースと公式ブログ記事は確認されず、Xは未確認。",
  "latestSummary": "直近24時間のClaude Codeリリースは0件。公式ブログに対象期間の日付の新記事はなく、Xは取得できなかった。",
  "summaryBullets": [
    "<strong>Claude Code</strong>: 対象期間内のGitHubリリースは0件。最新のv2.1.302は期間開始前に公開。",
    "<strong>公式ブログ</strong>: Engineering、Research、Anthropic News、Claude Resourcesの確認した一覧に10月17日・18日付の新記事は見当たらない。",
    "<strong>X</strong>: 専用検索が利用できず、公開プロフィールへの取得も拒否されたため、公式アカウントとエンジニアの投稿は未確認。"
  ],
  "officialNews": [],
  "officialZeroStates": [
    {
      "label": "公式ブログの期間内記事は確認できず",
      "body": "Engineering、Research、Anthropic News、Claude Resourcesの一覧を確認。最新のResearchとClaude Resourcesの掲載記事は10月16日付で対象期間より前。Engineeringの注目記事は10月13日公開、10月15日更新。"
    },
    {
      "label": "Xの投稿は未確認",
      "body": "X MCPの検索機能が利用できず、公式3アカウントと一部エンジニアの公開プロフィールも取得時に403となった。投稿や返信の有無は確認できていない。"
    }
  ],
  "signals": [],
  "releasePanels": [
    {
      "title": "ブログ",
      "headline": "期間内確認 0件",
      "body": "公式一覧に10月17日・18日付の新記事は見当たらない。",
      "url": "https://www.anthropic.com/research",
      "urlLabel": "Research一覧を開く"
    },
    {
      "title": "Claude Code リリース",
      "headline": "0件",
      "body": "GitHub CLIで公開日時を確認。最新のv2.1.302は2026年10月16日20:53:06 UTC公開で対象期間の開始前。期間内リリースがないため、和訳・分類の対象項目はない。",
      "url": "https://github.com/anthropics/claude-code/releases",
      "urlLabel": "GitHub Releasesを開く"
    }
  ],
  "exclusions": [
    "X MCPが利用できず公開プロフィールの取得も拒否されたため、公式・エンジニアの投稿と返信は未確認。",
    "10月16日以前に公開された公式ブログ記事とClaude Code v2.1.302は対象期間開始前のため除外。"
  ],
  "sources": [
    {"title": "Anthropic Engineering", "url": "https://www.anthropic.com/engineering"},
    {"title": "Anthropic Research", "url": "https://www.anthropic.com/research"},
    {"title": "Anthropic News", "url": "https://www.anthropic.com/news"},
    {"title": "Claude Resources", "url": "https://claude.com/resources/articles"},
    {"title": "Claude Code GitHub Releases", "url": "https://github.com/anthropics/claude-code/releases"}
  ]
}
