{
  "date": "2026-10-17",
  "windowLabel": "2026-10-16 18:03:27 UTC - 2026-10-17 18:03:27 UTC（JST: 2026年10月17日 03:03 - 10月18日 03:03）",
  "archiveTitle": "Quantum circuits and Japan agent workflows",
  "archiveSummary": "Claudeによる量子回路設計と、Anthropic JapanでのManaged Agents活用事例を収録。",
  "latestSummary": "Claudeの量子回路設計研究と、Anthropic JapanでのManaged Agentsによる営業ワークフローを紹介。Claude Codeの窓内リリースはなかった。",
  "summaryBullets": [
    "<strong>量子回路設計</strong>: Claudeが8つの量子回路設計課題で、既存の公開回路を上回る設計を見つけたとする研究を公開。",
    "<strong>Anthropic Japanのエージェント運用</strong>: Managed Agents、共有メモリ、Claude Tagを用いて、見込み客対応と日英メール作成を支援する営業フローを紹介。",
    "<strong>Claude Code リリース</strong>: GitHub CLIで確認した結果、対象24時間内の新規リリースは0件。",
    "X MCPが未提供のため、公式X・Anthropic engineer X投稿は一次情報として未確認。"
  ],
  "officialNews": [
    {
      "label": "Anthropic Research",
      "datetime": "2026-10-16T00:00:00Z",
      "displayTime": "2026年10月16日（公開時刻は記事に未記載）",
      "title": "Designing more efficient quantum circuits with Claude",
      "summary": "Claudeに自然言語の仕様と自動評価器を与え、化学・最適化・物理シミュレーション・数論にまたがる8つの量子回路設計を探索。既存の公開回路を上回る設計を見つけ、実用的な量子計算に必要な資源を削減できる可能性を示した。",
      "url": "https://www.anthropic.com/research/designing-efficient-quantum-circuits",
      "urlLabel": "公式記事を開く",
      "primary": true
    },
    {
      "label": "Claude Resources",
      "datetime": "2026-10-16T00:00:00Z",
      "displayTime": "2026年10月16日（公開時刻は記事に未記載）",
      "title": "How an Anthropic Japan BDR runs his day with a fleet of Claude agents",
      "summary": "Anthropic JapanのBDRが、リード振り分け、見込み客の精査、日英メール下書き、Salesforce更新、会議後フォローを複数のClaudeエージェントに分担。Managed Agentsへ移行し、共有メモリ、スケジュール、資格情報の管理を活用する運用を紹介する。",
      "url": "https://claude.com/resources/articles/how-an-anthropic-japan-business-development-representative-runs-his-day",
      "urlLabel": "公式記事を開く",
      "primary": true
    }
  ],
  "officialZeroStates": [
    {
      "label": "Engineering・Anthropic Newsの窓内新規記事は0件",
      "body": "公式一覧を確認。ResearchとClaude Resourcesの10月16日付記事を各1件収録した。両記事は公開時刻が記事にないため、可視の公開日を根拠としている。"
    },
    {
      "label": "公式X・engineer Xは未確認",
      "body": "Claude Official X WatchとAnthropic Engineer X Watchが前提とするX MCP toolが、この実行環境には提供されていない。"
    }
  ],
  "signals": [],
  "releasePanels": [
    {
      "title": "ブログ",
      "headline": "2件",
      "body": "Claudeによる量子回路の自律的な探索・最適化に関する研究と、Anthropic JapanのBDRがManaged AgentsとClaude Tagで営業業務を支援する実例を収録。Engineering・Anthropic Newsの窓内新規記事はなかった。",
      "url": "https://www.anthropic.com/research/designing-efficient-quantum-circuits",
      "urlLabel": "公式記事を開く"
    },
    {
      "title": "Claude Code リリース",
      "headline": "0件",
      "body": "GitHub CLIをsource of truthとして確認。最新のv2.1.301は2026-10-15T19:22:06Z公開で対象窓外のため、翻訳対象となる新機能・変更・修正はない。",
      "url": "https://github.com/anthropics/claude-code/releases",
      "urlLabel": "GitHub Releasesを開く"
    }
  ],
  "exclusions": [
    "X MCP未提供のためX投稿を除外。",
    "公開日または公開時刻が窓外の公式記事とClaude Codeリリースを除外。",
    "Claude Resourcesの「How the Claude Code team does code review」は記事本文の公開日が10月15日のため除外。"
  ],
  "sources": [
    {
      "title": "Anthropic Engineering",
      "url": "https://www.anthropic.com/engineering"
    },
    {
      "title": "Anthropic Research",
      "url": "https://www.anthropic.com/research"
    },
    {
      "title": "Anthropic News",
      "url": "https://www.anthropic.com/news"
    },
    {
      "title": "Claude Resources",
      "url": "https://claude.com/resources/articles"
    },
    {
      "title": "Designing more efficient quantum circuits with Claude",
      "url": "https://www.anthropic.com/research/designing-efficient-quantum-circuits"
    },
    {
      "title": "How an Anthropic Japan BDR runs his day with a fleet of Claude agents",
      "url": "https://claude.com/resources/articles/how-an-anthropic-japan-business-development-representative-runs-his-day"
    },
    {
      "title": "Claude Code Releases",
      "url": "https://github.com/anthropics/claude-code/releases"
    }
  ]
}
