{
  "date": "2026-10-14",
  "windowLabel": "2026-10-13 00:19:54 UTC - 2026-10-14 00:19:54 UTC（JST: 2026年10月13日09:19 - 10月14日09:19）",
  "archiveTitle": "Uberが語るAI向け内部脅威対策",
  "archiveSummary": "Claude Resourcesで、UberのAIエージェント向け内部脅威対策と監視基盤を扱う記事が公開されました。",
  "latestSummary": "UberがClaudeを使うAIの安全運用・監視について解説。Claude Codeの直近24時間リリースはありませんでした。",
  "summaryBullets": [
    "<strong>Claude Resources</strong>: UberのCISOが、AIエージェント向け内部脅威対策、可観測性、リアルタイム対応の考え方を解説。",
    "<strong>公式ブログ</strong>: Engineering、Research、Newsの窓内新規記事は0件。",
    "<strong>Claude Code</strong>: 直近24時間の新規リリースは0件。最新のv2.1.296は窓の開始前に公開。",
    "<strong>公式X・エンジニアX</strong>: X MCPが利用できないため、一次情報として未確認。"
  ],
  "officialNews": [
    {
      "label": "Claude Resources",
      "datetime": "2026-10-13T00:00:00Z",
      "displayTime": "2026年10月13日（公開時刻非掲載、JST）",
      "title": "UberのCISOが語る、AI向け内部脅威対策の構築",
      "summary": "UberのCISO、Philip Martin氏が、AIエージェントの監視・可観測性と、Enterprise Frontier Safeguardsと自社オープンソースのAI Detection and Responseを組み合わせたリアルタイム検知・対応の考え方を紹介した。公開時刻は非掲載のため、表示された公開日を基準に収録。",
      "url": "https://claude.com/resources/articles/uber-s-ciso-on-building-an-insider-threat-program-for-ai",
      "urlLabel": "Claude Resourcesで読む",
      "primary": true
    }
  ],
  "officialZeroStates": [
    {
      "label": "Engineering・Research・Newsの窓内新規記事は0件",
      "body": "Engineering、Research、Newsの公式一覧を確認。今回の24時間窓内に公開された記事は確認されなかった。Claude Resourcesでは10月13日付の記事1件を、公開時刻非掲載のため表示公開日基準で収録した。"
    },
    {
      "label": "Claude Codeの窓内新規リリースは0件",
      "body": "GitHub CLIで公式リリース一覧と最新v2.1.296の完全なリリースノートを確認。v2.1.296は2026年10月9日19:28:59 UTC公開で、今回の窓の開始前。"
    },
    {
      "label": "@AnthropicAI / @ClaudeAI / @ClaudeDevs は未確認",
      "body": "X MCPがこの実行環境にないため、投稿を一次情報として収録していない。"
    },
    {
      "label": "Anthropic engineer X signalは未確認",
      "body": "同じくX MCP非提供のため、監視対象アカウント群の投稿を一次情報として検証できず、signalsは空配列とした。"
    }
  ],
  "signals": [],
  "releasePanels": [
    {
      "title": "ブログ",
      "headline": "1件",
      "body": "Claude Resourcesで、UberのAIエージェントにおける内部脅威対策、監視、リアルタイム対応を扱う記事が公開された。Engineering、Research、Newsには窓内の新規記事はなかった。"
    },
    {
      "title": "Claude Code リリース",
      "headline": "0件",
      "body": "GitHub CLIで公式リリース一覧と最新v2.1.296の完全なリリースノートを確認したが、今回の24時間窓内の新規リリースはなかった。最新のv2.1.296は窓の開始前に公開されている。",
      "url": "https://github.com/anthropics/claude-code/releases",
      "urlLabel": "GitHub Releasesを開く"
    }
  ],
  "exclusions": [
    "X MCPがこの実行環境に未提供で、公式Xとengineer Xの投稿は一次情報として検証できないため除外。",
    "調査窓より前の公式ブログ記事とClaude Codeリリースは除外。Claude Resourcesの記事は公開時刻が非掲載のため、表示公開日（2026年10月13日）に基づき収録。"
  ],
  "sources": [
    {
      "title": "Anthropic Engineering",
      "url": "https://www.anthropic.com/engineering"
    },
    {
      "title": "Anthropic Research",
      "url": "https://www.anthropic.com/research"
    },
    {
      "title": "Anthropic News",
      "url": "https://www.anthropic.com/news"
    },
    {
      "title": "Uber's CISO on building an insider threat program for AI",
      "url": "https://claude.com/resources/articles/uber-s-ciso-on-building-an-insider-threat-program-for-ai"
    },
    {
      "title": "Claude Code Releases",
      "url": "https://github.com/anthropics/claude-code/releases"
    }
  ]
}
